{
  "type": "quadrant",
  "title": "Competitive Positioning",
  "takeaway": "The product aims for the high-value, high-automation quadrant.",
  "source": "Assumption based on user brief",
  "dataIntegrity": "assumption",
  "data": {
    "xAxis": { "label": "Automation depth", "low": "Manual", "high": "Autonomous" },
    "yAxis": { "label": "Buyer value", "low": "Low", "high": "High" },
    "items": [
      { "label": "Legacy suite", "x": 35, "y": 62 },
      { "label": "Point tool", "x": 48, "y": 42 },
      { "label": "Our product", "x": 78, "y": 82 }
    ]
  }
}
